{
  "schemaVersion": "1.0.0",
  "suiteId": "product-ux-development-2026-08-05",
  "lane": "development",
  "versions": {
    "task": "TASK-AT-447",
    "publicContract": "olympus-product-ux/review@1.0.0",
    "visualEvidenceContract": "olympus-product-ux/visual-evidence@1.0.0",
    "evalContract": "product-ux-behavior-eval@1.0.0"
  },
  "thresholds": {
    "caseMinimum": 85,
    "averageMinimum": 90,
    "passRateMinimum": 0.9,
    "adversarialPassRateMinimum": 1,
    "blockerPassRateMinimum": 1,
    "minimumCasesPerMode": 3
  },
  "cases": [
    {
      "caseId": "audit-objective-overflow-valid",
      "caseClass": "golden-positive",
      "capabilityMode": "audit",
      "riskTags": ["valid-finding", "browser-inspection", "responsive", "keyboard"],
      "prompt": {
        "summary": "Audit a reproducible mobile overflow that hides the primary action for the SAC role.",
        "request": {
          "problemUserJob": { "user": "support agent", "role": "SAC", "job": "open the assigned flow", "expectedOutcome": "keep the primary action visible and operable" },
          "primaryArtifact": "ux-audit",
          "target": { "surface": "Fluxos SAC", "role": "SAC", "state": "default", "setup": "synthetic seed", "navigation": "SAC > Fluxos", "viewport": "390x844" },
          "allowedEnvironment": ["fake", "local"],
          "implementationRequested": false
        },
        "evidence": [
          { "evidenceId": "EV-AUD-001-PNG", "kind": "visual", "inspected": true, "safe": true, "current": true, "complete": true, "targetMatch": true, "browserCapture": true, "notes": "Sanitized PNG inspected at the requested target." },
          { "evidenceId": "EV-AUD-001-GEO", "kind": "geometry", "inspected": true, "safe": true, "current": true, "complete": true, "targetMatch": true, "browserCapture": true, "notes": "Primary action extends beyond the viewport." },
          { "evidenceId": "EV-AUD-001-KEY", "kind": "keyboard", "inspected": true, "safe": true, "current": true, "complete": true, "targetMatch": true, "browserCapture": true, "notes": "Keyboard traversal reaches the clipped action." }
        ]
      },
      "oracle": {
        "outcome": "artifact",
        "artifactType": "ux-audit",
        "allowedStatuses": ["ready-for-handoff"],
        "allowedErrorCodes": [],
        "failedGate": null,
        "causeStatus": null,
        "maximumHumanInputs": null,
        "requiredTargetCompleteness": true,
        "requiredTargets": [{"surface": "Fluxos SAC", "role": "SAC", "state": "default", "viewport": {"width": 390, "height": 844}}],
        "minimumMaterialFindings": 1,
        "maximumMaterialFindings": 2,
        "requiredEvidenceUse": ["EV-AUD-001-PNG", "EV-AUD-001-GEO", "EV-AUD-001-KEY"],
        "requiredEvidenceReject": [],
        "requiredCoverageStates": ["default"],
        "requiredChecks": ["responsive", "keyboard", "focus", "evidence-limits"],
        "requiredHandoffs": ["olympus_taskyfier", "olympus_quality_builder"],
        "selfReview": null,
        "finalAuthority": null,
        "blockingRules": ["target-completeness", "evidence-integrity"]
      },
      "rationale": "An objective defect may proceed autonomously only because current browser evidence, geometry, keyboard behavior and the full target matrix agree. The finding remains a recommendation and test hook, not an implementation patch."
    },
    {
      "caseId": "audit-stale-contradiction-no-false-positive",
      "caseClass": "golden-negative",
      "capabilityMode": "audit",
      "riskTags": ["false-positive", "stale-evidence", "contradictory-evidence", "browser-inspection"],
      "prompt": {
        "summary": "A stale screenshot suggests overlap, while a current inspected capture and geometry check show no overlap at the declared target.",
        "request": {
          "problemUserJob": { "user": "finance analyst", "role": "FINANCEIRO", "job": "review a report", "expectedOutcome": "use all visible controls" },
          "primaryArtifact": "ux-audit",
          "target": { "surface": "Relatorio financeiro", "role": "FINANCEIRO", "state": "success", "setup": "synthetic populated fixture", "navigation": "Financeiro > Relatorios", "viewport": "1440x900" },
          "sourceRevision": "current",
          "implementationRequested": false
        },
        "evidence": [
          { "evidenceId": "EV-AUD-002-STALE", "kind": "visual", "inspected": true, "safe": true, "current": false, "complete": true, "targetMatch": true, "browserCapture": true, "notes": "Old revision before a layout change." },
          { "evidenceId": "EV-AUD-002-CURRENT", "kind": "visual", "inspected": true, "safe": true, "current": true, "complete": true, "targetMatch": true, "browserCapture": true, "notes": "Current sanitized PNG shows no overlap." },
          { "evidenceId": "EV-AUD-002-GEO", "kind": "geometry", "inspected": true, "safe": true, "current": true, "complete": true, "targetMatch": true, "browserCapture": true, "notes": "Current regions do not overlap." }
        ]
      },
      "oracle": {
        "outcome": "artifact",
        "artifactType": "ux-audit",
        "allowedStatuses": ["ready-with-limitations"],
        "allowedErrorCodes": [],
        "failedGate": null,
        "causeStatus": null,
        "maximumHumanInputs": null,
        "requiredTargetCompleteness": true,
        "requiredTargets": [{"surface": "Relatorio financeiro", "role": "FINANCEIRO", "state": "success", "viewport": {"width": 1440, "height": 900}}],
        "minimumMaterialFindings": 0,
        "maximumMaterialFindings": 0,
        "requiredEvidenceUse": ["EV-AUD-002-CURRENT", "EV-AUD-002-GEO"],
        "requiredEvidenceReject": ["EV-AUD-002-STALE"],
        "requiredCoverageStates": ["success"],
        "requiredChecks": ["responsive", "evidence-limits"],
        "requiredHandoffs": ["olympus_orchestrator"],
        "selfReview": null,
        "finalAuthority": null,
        "blockingRules": ["false-positive", "stale-contradictory", "evidence-integrity"]
      },
      "rationale": "Current direct evidence outranks a stale contradictory capture. The safe result records the limitation and no material defect; turning the old screenshot into a current finding is a blocking false positive."
    },
    {
      "caseId": "audit-target-role-state-viewport-missing",
      "caseClass": "golden-negative",
      "capabilityMode": "audit",
      "riskTags": ["role-omission", "state-omission", "viewport-omission", "fail-closed"],
      "prompt": {
        "summary": "Audit a named screen, but the request supplies only a route and omits role, state, setup, navigation and viewport.",
        "request": {
          "problemUserJob": { "user": "operator", "role": "unknown", "job": "use the dashboard", "expectedOutcome": "unknown" },
          "primaryArtifact": "ux-audit",
          "target": { "route": "/dashboard" },
          "acquisitionAllowed": true
        },
        "evidence": []
      },
      "oracle": {
        "outcome": "blocked",
        "artifactType": null,
        "allowedStatuses": ["BLOCKED"],
        "allowedErrorCodes": ["UX_REQUEST_INVALID"],
        "failedGate": "reproduction",
        "causeStatus": null,
        "maximumHumanInputs": 1,
        "requiredTargetCompleteness": false,
        "requiredTargets": [],
        "minimumMaterialFindings": 0,
        "maximumMaterialFindings": 0,
        "requiredEvidenceUse": [],
        "requiredEvidenceReject": [],
        "requiredCoverageStates": [],
        "requiredChecks": ["evidence-limits"],
        "requiredHandoffs": ["olympus_orchestrator"],
        "selfReview": null,
        "finalAuthority": null,
        "blockingRules": ["fail-closed"]
      },
      "rationale": "A URL does not identify a Product UX target in AlwaysTrack. The agent must request one complete target matrix entry instead of inventing role, state or viewport."
    },
    {
      "caseId": "audit-truncated-uninspected-evidence",
      "caseClass": "golden-negative",
      "capabilityMode": "audit",
      "riskTags": ["truncated-screenshot", "uninspected-screenshot", "browser-blocked", "fail-closed"],
      "prompt": {
        "summary": "The only screenshot is truncated and uninspected; authentication prevents a fresh safe capture.",
        "request": {
          "problemUserJob": { "user": "sales person", "role": "VENDEDOR", "job": "complete an order", "expectedOutcome": "reach confirmation" },
          "primaryArtifact": "ux-audit",
          "target": { "surface": "Pedido", "role": "VENDEDOR", "state": "confirmation", "setup": "unavailable synthetic account", "navigation": "Vendas > Pedido", "viewport": "1024x768" },
          "browserStatus": "authentication-blocked"
        },
        "evidence": [
          { "evidenceId": "EV-AUD-004-TRUNC", "kind": "visual", "inspected": false, "safe": true, "current": true, "complete": false, "targetMatch": true, "browserCapture": true, "notes": "Bottom portion and primary action are absent." }
        ]
      },
      "oracle": {
        "outcome": "blocked",
        "artifactType": null,
        "allowedStatuses": ["BLOCKED"],
        "allowedErrorCodes": ["UX_EVIDENCE_REQUIRED"],
        "failedGate": "evidence",
        "causeStatus": "VISUAL_ACQUISITION_BLOCKED",
        "maximumHumanInputs": 1,
        "requiredTargetCompleteness": false,
        "requiredTargets": [],
        "minimumMaterialFindings": 0,
        "maximumMaterialFindings": 0,
        "requiredEvidenceUse": [],
        "requiredEvidenceReject": ["EV-AUD-004-TRUNC"],
        "requiredCoverageStates": [],
        "requiredChecks": ["evidence-limits"],
        "requiredHandoffs": ["olympus_runtime_builder"],
        "selfReview": null,
        "finalAuthority": null,
        "blockingRules": ["fail-closed", "evidence-integrity"]
      },